{
  "schema_version": "1.0",
  "baseline_run_id": "20261005T031153Z-hardened",
  "current_run_id": "20261005T031728Z-drift",
  "generated_at": "2026-10-05T03:22:34Z",
  "regressions": [
    {
      "host": "lab-db",
      "control_id": "HL-FW-001",
      "before": "pass",
      "after": "fail"
    },
    {
      "host": "lab-web",
      "control_id": "HL-PERM-001",
      "before": "pass",
      "after": "fail"
    },
    {
      "host": "lab-web",
      "control_id": "HL-SSH-001",
      "before": "pass",
      "after": "fail"
    }
  ],
  "improvements": [],
  "new_checks": [],
  "missing_checks": [],
  "ansible_changed_tasks": [
    {
      "host": "lab-db",
      "task": "firewall : HL-FW-001 | Reload the ruleset when the running firewall drifted from the file",
      "control_ids": [
        "HL-FW-001"
      ]
    },
    {
      "host": "lab-web",
      "task": "file_permissions : HL-PERM-001 | Set ownership and mode of account files",
      "control_ids": [
        "HL-PERM-001"
      ]
    },
    {
      "host": "lab-web",
      "task": "ssh : HL-SSH-001, HL-SSH-002, HL-SSH-003, HL-SSH-004, HL-SSH-005, HL-SSH-006, HL-SSH-007, HL-SSH-009 | Deploy the hardened sshd_config",
      "control_ids": [
        "HL-SSH-001",
        "HL-SSH-002",
        "HL-SSH-003",
        "HL-SSH-004",
        "HL-SSH-005",
        "HL-SSH-006",
        "HL-SSH-009"
      ]
    }
  ],
  "verdict": "drift"
}
